,Review,Departments
1347,received today one not working nd working good,"Product Quality, Shipping"
1348,something ok,General
1349,came well packed apparently no damage previous one worked around months stopped working not get charged properly not started using one can say anything concrete update case anything significant ,Technical Support
1350,useless product poor quality picture show purple graphics every moves,Product Quality
1351,quality good expected fine also shipping took clot time recommend sure ,"Product Quality, Shipping"
1352, no seller product total different advertised less pockets cards material different no him holder place not buy returned ,"Product Quality, Marketing, Sales"
1353,poor quality it work wasted money ,Product Quality
1354,useless used no difference instead using useless product can saline exercise effective waste money,Product Quality
1355,weak product stopped little thick liquid ,Product Quality
1356,totally rubbish product light weight not smooth use totally waste money suggest everything buy logistic mouse little addition budget get handy product lasts six months never axis not ,"Product Quality, Sales"
1357,motor weak can not beat coffee wastage money ,Product Quality
1358,small size air pressure low can see size hand,General
1359,thought would work open operate beat coffee ,Sales
1360,not working ,Product Quality
1361,ordered mass one broken believe kiss size extremely small ,"Product Quality, Sales"
1362,not good pathetic quality not buy store,"Product Quality, Sales"
1363,fresh expensive not time ,General
1364,good delivery time nice packing covantity little fragrance good,Shipping
1365,poor quality product ,Product Quality
1366,product good size not according order one four pieces unable larger size ,"Product Quality, Sales"
1367,low quality no proper packing one ear piece working ,Product Quality
1368,returned item not compatible pad item received june th company still getting charged affirm payments ,"Product Quality, Shipping, Sales"
1369,not damaged shipping ,"Product Quality, Shipping"
1370,make sure device compatible buying ,"Technical Support, Sales"
1371,totally damage shoes bad experience ,General
1372,not buy hate speaker not working ,"Product Quality, Sales"
1373,worth price fragile hence can damaged easily no guide apply strip blue would help sticking strip not good quality overall give solid ,"Customer Service, Product Quality, Sales"
1374,red order taking not already received unloading pick kindly brief at different co taking also gets not ,"Shipping, Sales"
1375,order bag not review,Sales
1376,third class product battery not working ,Product Quality
1377,expensive quality low youcan say th th copy shampoo,Product Quality
1378,not recommended next order store waste time money ,Sales
1379,damaged product tried return product choose picked option rider called pick never came picked two days got email return request canceled ,"Customer Service, Product Quality"
1380,received product days by bit not good,"Product Quality, Shipping"
1381,items quality poor compared price unable hold weighted items not impressed ,"Product Quality, Sales"
1382,disappointing product memory card reader recommendation not purchase save money,"Product Quality, Sales"
1383,quality not good stoper like ,Product Quality
1384,thanks dark today received order like another order bricks sticks not receive ,"Shipping, Sales"
1385,gave pad pro apple pencil graduate student daughter less week use one side pencil developed nodule prevents pencil working side thus us expensive product defective one result minimal usage loyal apple amazon customer diminished respect ,Product Quality
1386,scar scar scar bought realise half not work not buy worst experience ever,Sales
1387,handy not expected ,General
1388,not first copy gone nd copy available market,Marketing
1389,shirt fabric not good design picture,General
1390,cut so tiny ,General
1391,thank arrived today check al ok quality so nyccc sound not good expected sound normal ,"Product Quality, Shipping"
1392,cheap quality product ,Product Quality
1393,dead arrival not charge pair instructions thin shows button feature not exist product magnetic charging annoying case pad ordered st generation instead next one not work buying knock brand rather overpriced apple brand ,"Product Quality, Marketing, Sales"
1394,got yesterday packing fine product also ok,Product Quality
1395,not working,Product Quality
1396,not luminous not glowing dark room packet feared side,General
1397,need improve packing satisfied quality cheese,Product Quality
1398,bad alesha gold perfume packing inner perfume bad dislike ,General
1399,expected good one,General
1400,cheaper not necessarily better not work going spend little next time get real apple status ,General
1401,pathetic not work days,General
1402,front door shattered mirror pieces falling pus replace fridge called dark balance instantly still no progress,Customer Service
1403,like good massage problem not rotating degree please reply ,"Customer Service, Technical Support"
1404,bad,General
1405,clean months not millennium stuff also not fresh feels year old product ,Product Quality
1406,remote not sanctioning light ok,General
1407,ordered second time not working last time not buy fraud,"Product Quality, Sales"
1408,makes no difference heals giving review several usage product ,Product Quality
1409,pathetic waste money received parcel mints not working ,"Product Quality, Shipping"
1410,fresh sweet potatoes,General
1411,received pack no instructions mentioned pack otherwise product looks fine ,"Product Quality, Shipping"
1412,way stars shining picture not shine like real ,General
1413,highly recommended product good quality reasonable price sound not high sound quality us good delivery time thank dark,"Product Quality, Shipping, Sales"
1414,not working tried everything still want exchange please,Product Quality
1415,shape okay not work sad waste money axis not say not work waste money,General
1416,fine ,General
1417,wrong product wrong color waste money,Product Quality
1418,came exactly ordered not tried yet not know result,Sales
1419,fucking quality ,Product Quality
1420,bought pad pencil not work ,General
1421,watch not working said please tell he replace ,"Customer Service, Product Quality"
1422,low quality one ear phone works time mid ear pieces not works also sound distortion noise not recommended ,Product Quality
1423,satisfactory,General
1424,got parcel days back kind cut like came really dusty also tiny hole bottom nice,Shipping
1425,check incompatibility model,General
1426,worst experience not working properly waste money not buy ,"Product Quality, Sales"
1427,one piece broken edge price double compare quality ,"Product Quality, Sales"
1428,face product send not working ,"Product Quality, Shipping"
1429,not mentioned can get warranty claim case god forbid anything went wrong ,General
1430,packing save looking good outside hope work inside well,General
1431,not expecting high quality product price product expectations pathetic plastic silicone third glad not clear black dots inside silicone washed not unable black dots can seen pictures,"Product Quality, Sales"
1432,disappointed supposed work pad pro new mind not different things supposed not not worth many pens work really well can use apple devices work really well not waste money pen not buy pen ,"Technical Support, Sales"
1433,faulty product checked sending product ,"Product Quality, Shipping, Technical Support"
1434,easy assemble reasonable quality play pedal hut therefore cycling not smooth ,Product Quality
1435,waste effort ,General
1436,ordered medium size sent large size worst experience ever surprised selling dark footing innocent customers ,Sales
1437,adequate stuff advertised ,Marketing
1438,poor quality product would notrecommend anyone connections loose adhesive not good material quality ver low working can not fix somewhere would not stick surface minutes ,Product Quality
1439,low quality like plastic not wast money,Product Quality
1440,horrible product pretty sure apple knock could not connect different apple devices tried waste money,"Product Quality, Technical Support"
1441,received prompt appearance nice taste sweet tastes like sweet potatoes,Shipping
1442,short length not fit bike ,General
1443,seen picture very small size,General
1444,not liking product ,Product Quality
1445,average ha price ke his se theah ha,Sales
1446,microwave fridge cover different colour overall good satisfy ,General
1447,daytime touch pad screen auto starts draw useless expel could not apple put status cap status end make option turn automatic drawing not needed major flaw needs fixed sap ,Technical Support
1448,sucks first buttons not work lights went ,General
1449,keyboard good came opened key not working excited vis not key not working ,Product Quality
1450,failed peace grade quality not picture peace damage not satisfied,Product Quality
1451,faces star ,General
1452,received product quality low ,"Product Quality, Shipping"
1453,not good different show picture not satisfied,General
1454,misses things not away connect right away can finicky still apple pencil love lovely satin finish nice little flat edge connect charge well handy applications not much say really fancy status ,General
1455, low quality bad shoes bad product save pocket money shoes work one match feeling hate owner seller allah ask ,Product Quality
1456,bad product week lights get low low,Product Quality
1457,poor service order glasses yellow frame received black basically order two glasses separately one black frame glasses receive feb feb yellow receive days ,"Customer Service, Shipping, Sales"
1458,not recommended damaged stick light material ,Product Quality
1459,safely delivered time got free tested night love like tested perfume merry perfume good nice fragrance not last much longer expected ,General
1460,totally rotten please take action ,General
1461,shoes right size ordered not come small feet ,Sales
1462,calling not good microphone not good person hardly listen voice,Customer Service
1463,got product led receiver female plugs can connect ,Product Quality
1464,color comb fine,General
1465,quality average thing not like colors different led separately colors not mixed colored led single point proper color mixture combination,"Product Quality, Sales"
1466,ordered product pair got bluetooth missing packing pathetic even ear hook single bluetooth broken waste money total fraud thankful dark processes return ,"Product Quality, Sales"
1467,not dusting even cards ,General
1468,sweet taste seems ingredient not advertise claim package not pure peanuts butter make homemade well know taste pure one well,Shipping
1469, shirts local worst quality also damaged shirts quality fine not satisfied seller not recommended ,Product Quality
1470,bag not shown pick ok price sending one thing showing another one fraud suggest seller avoid fraudulent deals can give stars,"Shipping, Sales"
1471,pathetic quality not working properly since day not even match quality copy headphones using headphones since last year worst product could ever get ,Product Quality
1472,not pump oil come last piece good piece missing part,General
1473,average quality rubber bit smell unknown nature rubber sticky not look like long last,Product Quality
1474,not sure pencil started acting recently first started using weeks ago worked fearlessly last week using presentation disconnected repair pad not big deal since happened presentation fast forward past weekend drawing another presentation week started disconcerting axis not in not sure software pitch highly frustration your far along stops working paring easy inconvenient,"Shipping, Technical Support, Sales"
1475,shirts smelled pretty bad kept storage three years two shirts defective holes got shirts washed lost colors material thick makes sweat use winter night suit not buy cloths kept shipped dark buy sellers deliver fresh stock ,"Product Quality, Sales"
1476,buy speakers per mentioned reviews quality pathetic used not week can see results not prefer buy anybody ,"Product Quality, Sales"
1477,new apple pencil not work recording marks writing followed instructions used online tutorials sought help apple support lemon apple sent another see works must common problem apple not even want return defective pencil ,"Customer Service, Product Quality, Technical Support"
1478,not planted yet,General
1479,taste ok not like draft better local products,Product Quality
1480, sorry quality not good tore put clothes ,Product Quality
1481,bad experience shopping dark time,General
1482,outer time also called changing cuba office still fault not trace also nobody can help solve issue next not purchase draw,"Customer Service, Technical Support, Sales"
1483,received lotion ordered mahan cream poor service,"Customer Service, Shipping, Sales"
1484,little slow show temperature detect accurate temperature quickly,"Shipping, Sales"
1485,broken high price,"Product Quality, Sales"
1486,faulty product,"Product Quality, Technical Support"
1487,done not compatible pad reading fundamental curtis not folks not read curtis not folks ,General
1488,things excellent delivery time bad,Shipping
1489,quality stuff bad stitching coming every disappointed ,Product Quality
1490,working fine using issue charging pin unstable difficult charge ,"Product Quality, Technical Support"
1491,think great can find way convert he he not show heart rate accurately ,Sales
1492,good thankyou dark one light blue bake say best ,General
1493,worst experience please not buy plastic like egg white dirty outside no expire mentioned ,Sales
1494,build quality not good order houses one got expired within days ,"Product Quality, Sales"
1495,good quality sizes confusing ,Product Quality
1496,product great fitted handfree tireless heads inside really handy recommended ,Product Quality
1497,light turns minutes running getting hot delivery today bad quality,"Product Quality, Shipping"
1498,adhesive bandages ordered dark weak making ineffective providing proper wound protection,Sales
1499,shoes not good not want purchase shoes,Sales
1500,no good stuff used bags ar normal someone purchase discount price ok worth delivered time,Sales
1501,poor quality kindly not sell products ,Product Quality
1502,left airport not working low quantity sound not buy not worth ,"Product Quality, Sales"
1503,neck deep good ,General
1504,big size not per order return please,Sales
1505,seen lot reviews two major types styluses people talk pencil pad pro pad pro model last version responsive really really clung use long battery life horrible newer version better still horrid battery life loses conductivity frequently apple solved connecting device every time charge good no company could get away kind experience comparison status surface pro natural level friction screen response rate isn fast said battery life connection reliability way ahead apple pencil never loses connection battery life like years days like pencil yes know ms one uses battery battery lasts forever pencil costs less hard give pencil great value rating ,"Customer Service, Shipping, Technical Support, Sales"
1506,color not shown picture quality also average,Product Quality
1507,pencil not connect not work,General
1508,shoes great seizing not proper in normally ordered case size fits sized person otherwise shoes great quality especially price,"Product Quality, Sales"
1509,price high quality good,"Product Quality, Sales"
1510,found one strip not working ,Product Quality
1511,fine not good,General
1512,color not picture show overall good product pricetag recommend sealed kindly change courier service much late delivery process,"Customer Service, Product Quality, Shipping, Sales"
1513,sir not working know two friends bought item already working device keeps scanning not show result please not buy anything seller device no use ,"Product Quality, Technical Support, Sales"
1514,nice need quality improve nose figure not fit,Product Quality
1515,effective ,General
1516,three stars indicative value money not expecting product high quality light intensity extremely poor recommend seller sell decorative lights ,"Product Quality, Sales"
1517,not recommended upper part not lock properly even many tries ,General
1518,quality shirt average guess fine wearing one season ,Product Quality
1519,good item musical cell not working son loving putting new cell,Product Quality
1520,toy,General
1521,normal quality not good not design design common anyway satisfied,Product Quality
1522,massage works plugged soon plug stops working not recommended ,General
1523,pakistans seller bad,General
1524,everything ok except press switch trimmed would not turn give little push pull tip starts times charge fully give final review still problem contact chat otherwise get stars course follow yeah no manual box plus box stick shop name product mentioned printed box instead stick stick ,"Product Quality, Technical Support"
1525,good product small price power dwyer awesome received open packing lose packing packing improved ,"Product Quality, Shipping, Sales"
1526,underwear good good quality nice colors hopefully stay good wash thing noticed underwear different sizes would better one size product not ladies think mention girls got sister fit not perfectly yeah ,Product Quality
1527,brush poor quality arrived broken want replacement ,"Product Quality, Shipping"
1528,horrible not stick wall came broken ,Product Quality
1529,looking okay let see work not creature log box hopefully creature not cheating parisian everything possible ,General
1530,waste money oder poor quality,Product Quality
1531,quality good vibration ,Product Quality
1532,poor quality never buy,"Product Quality, Sales"
1533,key board first letter stopped working half hour os usage ,General
1534,product ok,Product Quality
1535,packing fragile even metal would broken packing transportation one carbon not mm thick extremely disappointed store returned product,Product Quality
1536,not fit dwyer not universal size,General
1537,base not strong,General
1538,poor product would not take free quality poor not fulfill purpose wrist support wrist support useless ,"Customer Service, Product Quality"
1539,not connect pad pro anymore,General
1540,not good thought,General
1541,broken shampoo received,"Product Quality, Shipping"
1542, adhesive useless beyond imagination tried keep place double sided tape still kept falling co not enough support weight presume no guideline manual address issue ,"Customer Service, Technical Support"
1543,overall good thing pick absorb liquid however time ,General
1544,order straightening cream cream two tube cream receive tube disappointing dark services disclaimer buyers mood buy not buy seller summer ply contact details,"Customer Service, Sales"
1545,not like parcel,Shipping
1546,bad quality,Product Quality
1547,poor unable product first time disappoint ,Product Quality
1548,normal quality ,Product Quality
1549,okay product not want waste money not buy ,"Product Quality, Sales"
1550,per gazing mouse simple optical mouse led lights not fair change name gazing mouse different optical mouse think matter go consumer court ,General
1551,potatoes not look fresh ordered rubles sale dark deliver order within days super fast service,"Customer Service, Shipping, Sales"
1552,not glow dark wall,General
1553,bad quality not working,Product Quality
1554,received late poor delivery service,"Customer Service, Shipping"
1555,product much bad quality product material much rubbish not one order scar bad product bloody trap name mouse not original product saw ordered ,"Product Quality, Sales"
1556,ordered first mind today led received one week broken ,"Product Quality, Shipping, Sales"
1557,not receive ordered ,Sales
1558,totally face use less item order something received thin else block vendor never suggest buy anything,"Product Quality, Shipping, Sales"
1559,defective piece received not good ,"Product Quality, Shipping"
1560,light weighted not comfortable slippery petty floor normal use not bad,General
1561,makes teeth one shade lighter short time ,General
1562,shoes quality satisfactory good price range seller sent wrong shoe size even multiple reminders personal chat filed return already hoping get refund soon can recorder choose shoes store thanks,"Product Quality, Sales"
1563,bad experience seller send used handfree set cheap used shame ,Shipping
1564,requested via chat check sending sending abroad received football defeated leaking air one side pathetic ,Shipping
1565,low quality one light one button missing blue wheels picture received black real,"Product Quality, Shipping"
1566,not order,Sales
1567,sold amazon com received time prime no plastic wrap sliding box inside wrong direction otherwise product fine might keep not paid full price brand new item ,"Customer Service, Product Quality, Shipping, Marketing, Sales"
1568,pretty expensive,General
1569,average seasonal belt nothing special rough ok one season ,General
1570,not fresh ok,General
1571,no bass no original gone second copy,General
1572,bought high school daughter school distance learning pad pro literally rolled desk fell feet tip plastic metal internal piece broke falling spending pad pro pencil web chatted apple talked one local apple store seemed interested logging conversation pad talking response buy insurance pad not go away can help next seriously hard time writing owning countless apple products owning good amount stock awful expect either build better products stand behind theme better likely buy market brand can not worse thanks apple said sarcastically customer support make become next ism exactly ,"Customer Service, Product Quality, Marketing, Sales"
1573,not good quality belt belt thickness much belt looks cheap,Product Quality
1574,poor thermal conductivity ,General
1575,product okay unpacking wet packed tight moisture oris noted box keep quality ,Product Quality
1576, rickets scuttle average quality,Product Quality
1577,good product carry along small size performing well ,Product Quality
1578,bought daughters new pad pro black friday would show pencil not ask connect went best buy ask help not asking much research couture waste time go reputable place buy sent back since would not connect write anything going best buy get money back buy ,"Customer Service, Sales"
1579,received quality cheap not satisfied ,"Product Quality, Shipping"
1580,bad quality not show pick even case copy no bass no sound quality totally not satisfied ,Product Quality
1581,product different shown add think get add pick internet product not per dis appointed seller add pick,Product Quality
1582,bad experience ,General
1583,packed way bristled pressed asked seller provide way not get damaged pressed,Product Quality
1584,received item shown quality average reasonable price suggestions article must fresh sent customers ll bit mortier unclean ordered written received instead okay,"Product Quality, Shipping, Sales"
1585,overall quality not good enough delivery time bad,"Product Quality, Shipping"
1586,sent smaller ones expecting larger size wasted money,General
1587,bought ac last year march worked months tried not working saying warranty expense ridiculous paid almost months waste no one helping company,"Customer Service, Product Quality, Sales"
1588,good color not ,General
1589,not use month one isn turning not connecting worst ,General
1590,stars not reflecting shining ,General
1591,not good mid no working properly waste money not good ,General
1592,perfume shape quality smell good thing not like sent red pink one missing ,Product Quality
1593,quality third class next time not buy,"Product Quality, Sales"
1594,much humming sound plus ear plug connecting tube small may work good person much hearing loss ,General
1595,arrived packing not work went troubleshooting methods no luck joke considering product prices ,"Product Quality, Shipping, Sales"
1596,bad quality led torch bad experience,Product Quality
1597,poor experience even shopping dark mary ordered pack comb receiving actual price removed selling old stock,Sales
1598,pathetic seller poor service order apple parceled mange extremely poor service ,"Customer Service, Shipping, Sales"
1599,product not thing maybe using times might ,Product Quality
1600,poor customer services agreed chat seller supposed send colors described picture received different color shirts ,"Customer Service, Shipping"
1601,product genuine spelling bit bottle charging high amount delivery still sending leaned bottle ,"Product Quality, Shipping"
1602,costly,Sales
1603,face smaller change watch colour,General
1604,not nice sure sweet potatoes not recommend sorry dark sell quality product stay quality level ,Product Quality
1605,plastic remote buttons low quality ,Product Quality
1606,used apple pencil not even connect pad,General
1607,not feel anywhere near real local feels like written packing local parisian put ltd no licensing international brand nothing else mentioned consistency bit better water think can get dark flagship store ,Marketing
1608,grip not good description wrote gazing mouse isn gazing mouse,General
1609,totally unsatisfied watch full scratches least sent new one somehow working disappointed gift,General
1610,cheap quality,Product Quality
1611,really bad service store almost star rating ordered paid price pack received pack price dark grey one missing contracted no response really shame ,"Customer Service, Shipping, Sales"
1612,not shine shown,General
1613, face smaller alert beware pakistaniyoon low quality product lock bracelets damage low quality item not match describe description pictures please not buy anything ,"Product Quality, Sales"
1614,shown not worked described use his not not found relaxation quality good improve product ,Product Quality
