,Review,Departments
2667,disappointed paid bottle pump received bottle lip top not alcohol based disinfectant either please not waste money product better use soap ,"Customer Service, Product Quality, Shipping"
2668,moisture or skin nothing else,General
2669,bad pencil,General
2670,worst product experience life bought th gen pad pro got go first step troubleshooting list checked boys work together pencil would pair could even see general section settings pp no response screen none can double fingertips know screen pad fine run whole list steps appletoolbox webster nothing works call apple support since note troubleshooting steps including forethought order replacement tips try due basically said could drive get replacement service fee broken brand new item not even his possession want another fix sold broken no thanks ,"Customer Service, Product Quality, Marketing, Sales"
2671,bought like new amazon services faulty stuff going life return window thank amazon putting ,"Customer Service, Product Quality, Technical Support"
2672,bad experience packing somehow acceptable lens frame poor kindly not waste time money seller products look lens frame,Product Quality
2673,love product not leak no period stir not new holy grain issue even though ordered large still little tight kindly introduce sizes thank ,"Product Quality, Technical Support, Sales"
2674,good not much ,General
2675,local those poor stuff soon cheap,General
2676,product quality packing excellent rider services worst really disappointed behavior tis,"Customer Service, Product Quality"
2677,received proper packing operative manual also included otherwise wastage time net bc net not qualified ,"Product Quality, Shipping"
2678,handy voice distortion occurs sometimes ,General
2679,not described protective spray good like ,General
2680,excellent product not like shown pick not multiple steps adjust like shown pick can adjust steel lock,Product Quality
2681,said sent bottle sent half empty,Customer Service
2682,received time expected good quality sound worst bought local shop worst quality bad expected high quality converted not sound card sound quality not good everything good deliver time price good seller nice offer coupon ,"Product Quality, Shipping, Sales"
2683,first order damaged contact size company give voucher purchased axis not right not recommend boy colours,"Product Quality, Sales"
2684,shirt fine size not fit ,General
2685,remote look like not model think changed,General
2686,customer service responsive provided solution wait time helping long ,Customer Service
2687,bad product small ,Product Quality
2688,can charge use pad,General
2689,waste products,Product Quality
2690,purchasing confirmed seller scanned shows arbat mrs as status seller told available motor data application purchase tried pp pp not support arbat as gives option purchase plains instead ,"Customer Service, Sales"
2691,item received time no doubt quality super fine packing compromised needs improvement packing,"Product Quality, Shipping"
2692,nd experience dark buy upon st one good one bad ear phone not working malfunctioning one ear phone working vendor quality control mechanism,"Product Quality, Technical Support, Sales"
2693,bad product said can open cm not even fit cm,"Customer Service, Product Quality"
2694,seems like used product timing mind money wasted ,Product Quality
2695,charging problem not charging,Technical Support
2696,wrong item received order black one send blue one,"Product Quality, Shipping, Sales"
2697, things product not inches nd marking paper not direct according alphabet digits tape not small pieces received ,"Product Quality, Shipping"
2698,made cheap quality,Product Quality
2699,original product shown picture quantity gram h,Product Quality
2700,powerful product somewhere also feel realize product used specially gold blade rusty dark kindly work ,Product Quality
2701,left apiece low sound looks like faulty one ,"Product Quality, Technical Support"
2702,quality good size small charge ,Product Quality
2703,nothing special good price ,Sales
2704,low quality ,Product Quality
2705,unable connect pad pro th gen amazon prime returns his notes ,General
2706,face item returned reply drop dark shop would bought bazaar waste money benefit home delivery running ,"Customer Service, Product Quality, Shipping"
2707,he received device however not connect mobile bluetooth whenever select obdii connect first asks password pair entering password goes previously connected devices tried axis not axis not every time happened also tried mobile ,"Shipping, Technical Support"
2708,takes week deliver single product bad service,"Customer Service, Product Quality"
2709,not great trust small could not fit ,General
2710,real broken product leaned cap ,Product Quality
2711,poor packing otherwise excellent sound quality,Product Quality
2712,seems fine use bad quality ka path chalky ga delivered time ,Product Quality
2713,seller disappointed recycle plastic material used kiss toys bad burned plastic smell quite thin material even damaged ,Product Quality
2714,far quality small size not quality advertised ,"Product Quality, Marketing"
2715,good product quality good delivery little bit late ok ,"Product Quality, Shipping"
2716,feel good product not reliable cheered a ti in not portable tear he jay but old hi carry army ho ,Product Quality
2717,poor result think face product disappointed ,Product Quality
2718,seems not test used products selling received apple pencil not work connected pad everything seems ok however take use instantly gets impaired mediocre,"Product Quality, Shipping"
2719,stopped working month,General
2720,received tireless hand free two issues no us charging cable not even getting charging ,"Shipping, Technical Support"
2721,not work,General
2722,disappointed poor quality,Product Quality
2723,product described satisfactory operational manual missing ,Product Quality
2724,received today fast delivery not glow shown advertisement overall experience good ,"Shipping, Marketing"
2725,works fine usual apple products pencil expensive since not get used much fancy cadet ,Product Quality
2726,received product average packing apply thermal paste years old lawton showing temperature applying showing temperature ,"Product Quality, Shipping"
2727,work time not work,General
2728,see fabric opening eyes narrow cm early can open eyes not recommend,General
2729,not work japanese cars,General
2730,think not star plastic h latin but cut happy service thanks seller dark,Customer Service
2731,firstly good one half months later one damaged one works another one not ,Product Quality
2732,nice packing pad dirt back side not know say ,General
2733,well packed lights dim ,General
2734,totally trash worked one day second day ordered three first mouse stroll wheel not works second buttons not works third mouse totally useless buttons work not moves,Sales
2735,not expecting irresponsible sent queen ordered rose ,Sales
2736,pathetic quality innersoles hard not comfortable,Product Quality
2737,bubbles bottles,General
2738,request change packing thick not come bottle recommend girl want light skin tone,General
2739,normal quality not much good quite good neutral ,Product Quality
2740,nice quality not charge phone shows phone charging phone not charge event using original cable ,Product Quality
2741,online paid product not received product received days first parcel received least in not loss ,"Customer Service, Product Quality, Shipping"
2742,felt pencil could offer features configuration flexibility typical apple fashion pay less features ,Sales
2743,expecting dark color okay ,General
2744, rd order packing average axis not lasted week broken middle ,"Product Quality, Sales"
2745,good quality improved ,Product Quality
2746,nice product written bead came beads,Product Quality
2747,selling double price everytime,Sales
2748,disappointed not work not good quality,Product Quality
2749,medical product received dark incomplete instructions documentation essential clear comprehensive instructions proper usage safety precautions lack attention detail reflect poorly seller ,"Product Quality, Shipping"
2750,send wrong number asking replied not returnable pathetic ,Shipping
2751,received seems good early share results update use ,"Shipping, Technical Support"
2752,box would not work no matter tried called apple teach support confirmed defective advised take nearest apple store replacement since one year warranty wrong apple would not honor one year warranty drove nearest apple store explain noted apple teach support sent replacement told no apple would not honor warranty products purchased amazon not waste money apple products spent last five months apple desktop pad phone is max airport pro apple pencil trouble every piece requiring least eighteen calls teach support hours hours wasted time enormous frustration get products work apple gone straight toilet ever since steve jobs passed away seriously considering returning every item can get refund going samson replacement samson smartphone performed fearlessly intuitively ever since got four years ago not required single call teach support apple fancy years last five months frustration wasted time energy not anymore lost loyal customer apple looks like time sell stock experience last five months not portend well company going forward ,"Customer Service, Product Quality, Sales"
2753,highly disappointed,General
2754,low quality,Product Quality
2755,beset handfree received time not get free gift ,Shipping
2756,want tu return ,General
2757,quality good except sent incorrect sizes,Product Quality
2758,stock sold seems old stir not back ,General
2759,using months decent sound boasted bass not great good price can recommend ,Sales
2760,charge flat sucks hate hard tip buy silicone case tip take every single day charge thing multiple times day not apple make rubberized tip also bought two pencils could use one charging hope one pencil allowed time ridiculously overpriced around dumb mio ,Sales
2761,wrong size disappointed time,General
2762,color football faded one day quality not good returned not get refund yet service slow cannot imagine football not suggest ball try another football not thermal molded play ball turn white color one week original color quick start faded quality not good enough,"Customer Service, Product Quality, Shipping"
2763,colour little bit pinkish instead red shown overall good ,General
2764,not buy toy poor quality would not fit either try something lot size can find better fit not recommended ,"Product Quality, Sales"
2765,low cheap quality mid sa away boot those at ha ply deliver right things log a log to pure pass data a log no product data ho sham ,Product Quality
2766,not good no form shmapoo,General
2767,got five potatoes less usual g fine otherwise though no rotten cut pus ,General
2768,bad quality,Product Quality
2769,ordered blue color received one mirrors lights broken quality not good fine careful purchase,"Customer Service, Product Quality, Shipping, Sales"
2770,opened box no pen missing pus assist never issue ,Technical Support
2771,packing awesome brush harsh foam soft,General
2772,worst product ever strongly recommend not purchase first low battery timing hours box charge pads time within week dead no charging anymore not able use would not charge anymore,"Product Quality, Sales"
2773,made mind not purchase anything axis not dark co last time purchased perfume not perfume rather bottle full water dark promised assured not happen axis not time ordered gone hands free one side not working forced say dark platform people robbed name dark ,"Product Quality, Sales"
2774,received bags week ago little bit dissatisfied quality bags fabric sticking poor ,"Product Quality, Shipping"
2775,shown ,General
2776,warranty card not filled signed seller ,General
2777,purchased apple pencil work product appears intact charged one time not charge placed charging magnet side pad able use pencil not worked since time would not recommend ,"Product Quality, Sales"
2778,product not new advertised,"Product Quality, Marketing"
2779,good delivery took bit time much cheaper online thing sold thousand watson,Shipping
2780,ear voice low microphone quality also bed can use calls,"Customer Service, Product Quality"
2781,pus vantage pus local,General
2782,worst product not received mentioned smell refine used ,"Product Quality, Shipping"
2783,received days order received days dark give delivery time called clot dark well shipping company dark said resolving issue shipping company said deliver turns come no matter draw give time calling sultan service center number free installation per give us offers no one picked call whole day decided install self ,"Customer Service, Shipping, Technical Support, Sales"
2784,not fitted watch,General
2785,small size useful household one scapula used otherwise spoon placing not work ,General
2786,always two things product quality quantity give review product quantity normal customer not know quantity my see picture order extremely small size is is delivery charges purchase cosmetic store nearby,"Product Quality, Shipping, Sales"
2787,not satisfied bluetooth box opened no accessory accessory box empty ,General
2788, love not glowing much ,General
2789,offence customer ga auto ,General
2790,ok market can get less price dark work less prices product shipping otherwise great platform shopping,"Product Quality, Shipping, Marketing, Sales"
2791,product delivered not advertised martin flavor replaced another one otherwise products received genuine new proper packing kindly ask seller update listing per stock available rather sending product choice ,"Product Quality, Shipping, Technical Support, Marketing"
2792,long product and ,Product Quality
2793,limited functions make sure right device bought two versions neither works work either devices,Technical Support
2794,completely useless not even real jeans stuff size really small,General
2795,works fine product quality not good,Product Quality
2796,amazing product years back started using gone earphones since no going back ,Product Quality
2797,whoso great product,Product Quality
2798,ruined skin stop using face axis not ,General
2799,sent wrong product not want black seeds can see order see picture posted product given wrong intentionally ,"Product Quality, Sales"
2800,months not working,Product Quality
2801,poor material poor quality not recommended ,Product Quality
2802,speakers kind weak even bass not strong can not play full volume lot bass music even wires short can move around keeping around lawton desktop pp cost range finest,Sales
2803,useless waste money ,General
2804,damaged sites disappointed low quality plastic ,Product Quality
2805,received late expected item broken damaged ,"Product Quality, Shipping"
2806,bad product,Product Quality
2807,pencil not work charged fine pad never saw returned return lost transit ,General
2808,face ate active one piece shame ,General
2809,got pencil connect bluetooth double click works can not write not working,Product Quality
2810,sale no warranty included price ,Sales
2811,pencil great product game changes people use like reading ton music every day marking scores one single drop floor rehearsal broke tip senior no way repair thing replace cost makes hard pill swallow seeking alternative solution ,"Product Quality, Sales"
2812,useless not recommended ,General
2813,product not mark not get job note not recommended ,Product Quality
2814,okay not good quantities half bottles ,General
2815,ll bit smaller length wise otherwise okay working perfectly hope blue long last,General
2816,received item described no software d manual received product ,"Product Quality, Shipping, Technical Support"
2817,received parcel length way shorter size given chart,Shipping
2818,not connecting mobile useless watch seller not recommended ,General
2819,not received required product also no call attend cotton ear phone not satisfied product ,"Customer Service, Product Quality, Shipping"
2820,not like quality average quality ,Product Quality
2821,ve lower material not like picture cellar fraud not buy store show pictures something send something bad,"Product Quality, Shipping, Sales"
2822,well new apple products not realize labrynthian product release plan across multiple items got apple pencil thinking would compatible latest pad bought latest pad pro regular pad no matter released sorry bought useless piece plastic ever heard apple good support incompatibility ease use guess figured complete lie simply trying figure latest pad legion release generations years associated operation astounding not broad support across release year would call pencil instead pencil pro far fitting way presenting convinced apple intentionally baffled people way labels presents product labels strictly sell stuff can cream pencil pro share blame obviously ridiculous deceptive best ,"Customer Service, Product Quality"
2823,stuff not good can not afford heavyweight although large space rate like not good not bad,Sales
2824,wrong color chosen yellow color send pink color returned nasal tis ,Shipping
2825,star ok ok ha par size torn small ha,General
2826,bad experience not finger wax simple wax face not recommended,General
2827,delivery late not exact she red wanted overall product good ,"Product Quality, Shipping"
2828,battery tidings not good half hour ,General
2829,small size not enough space cut ,General
2830,today got ac installed believe not working way ton ac working barely cooling not sure exactly issue also using ton ac perfect somehow not okay air throw way low regular ton actually causing low cooling even turn settings ,"Product Quality, Technical Support"
2831,bus cheek the,General
2832,basically looks original material lighter checked buttons using phone camera checked to well seems working fine ,"Customer Service, Product Quality"
2833,competing products device would quickly consider evaluation knock replacement none features pen even considered realm competitive biggest problem pen right battery not last long enough can easily drawing writing hours time and knows need case pad available cases make keeping pen charged impossible currently hunt ways charge pen damn need power need bluetooth pen beyond sure correction palm rejection come better low lowered way things plus pen way sang thick tend prefer much finer writing utilities also struggling learning translate style much larger tip not like also pen prices half much current pricepoint feels greedy hoping knock can come implement features correctly would not hold breath ,"Product Quality, Shipping, Technical Support, Sales"
2834,poor sound quality issues mid well battery also very poor not recommended ,"Product Quality, Technical Support"
2835,original product delivery time packing average can improved warranty card available date purchase,"Product Quality, Shipping, Sales"
2836,okay delivered late ,General
2837,outdoor unit not working installation highly disappointed please take back,"Product Quality, Technical Support"
2838,month started delaying games,General
2839,quality packing decent cannot activate airport time left airport senior not working ,Product Quality
2840,not dip mentioned title description dip material cheap plastic okay price not lure customer using face descriptions shopping dark really nice experience delivered within days ,"Product Quality, Sales"
2841,one ear god not working connecting bluetooth please tell fix change please ,Product Quality
2842,delivery perfect quality much poor,"Product Quality, Shipping"
2843,bad experience poor quality airport disappointed going install pp,"Product Quality, Technical Support"
2844,no anti blue light spectrum lenses,General
2845,quality fine,Product Quality
2846,excellent glasses though magnet not powerful enough settle automatically good price seller co operative,"Customer Service, Sales"
2847,working supposed blue not strong use small light weight products ,Product Quality
2848,material not strong gives feeling bursting time,Product Quality
2849,quality cheap,Product Quality
2850,average results fine price,Sales
2851,bare ni cheek i boat problem his ma bare i bus ,Technical Support
2852,received order turning turned stopped working,"Shipping, Sales"
2853,not working hand civic reborn tried andros head unit swell andros phone ,Product Quality
2854,good quality average ,Product Quality
2855,pencil amazing little weeks already worn tip can see underlying metal apple product expensive would expect tip last longer even come replacement figured would replace not nearly soon ,Product Quality
2856,purchased used like new apple pencil ends pencil chewed completely unable used ,Sales
2857,got product day expected delivery date product not work car tooth pass bluetooth conductivity fine however etc not connect ,"Product Quality, Shipping"
2858,not working led movie not supported glasses,"Customer Service, Product Quality"
2859,can not figure working properly not ,General
2860,low quality material high price not recommended air slow disappointed,"Product Quality, Shipping, Sales"
2861,not think works tried twice better go up light whitening things,General
2862,received wrong adapted lights disappointment ,Shipping
2863,pathetic service ordered red colour description page also red sent different colour ,"Customer Service, Sales"
2864,not recipe designs ordered quality covers need improvement quality compared price low,"Product Quality, Sales"
2865,not worth buying no use waste,Sales
2866,smells good lasts hours ,General
2867,item shown pictures works fine ,Product Quality
2868,delivery charges much ,Shipping
2869,received wrong speaker think not stock current product compensation send overall quality speaker good ,"Product Quality, Shipping"
2870,need pen pad use procreate knock off would not compare course sold separately cost way much easily breaks drop thanks apple another oris not replacement extra tips since break ,Sales
2871,used apple pencil gen not work specifically made sure checked new ordering came no wrapping box pencil pencil charged not think much could not get pencil work new pad air gen went best buy bought new apple pencil gen box sealed pencil sealed not charged charging worked great would not awful used actually worked beware slammed price ,"Customer Service, Shipping, Sales"
2872,buttons bit hard not useful permanent wearing steps could taken within specific area ,General
2873,rolled couch owning months stopped working flies expensive item apple could not fix refused replace warranty not cover falls disappointed ,Product Quality
2874,product seems fine okay however yet use check quality per price ,"Product Quality, Sales"
2875,loose packing old stock shame behavior dark,Customer Service
2876,reasonable,General
2877,side bluetooth not working not even working mind,Product Quality
2878,quality ok price want good quality not recommend product ,"Product Quality, Sales"
2879,not working can suggest ,Product Quality
2880,not portable used bottles,General
2881,bad quality never buy ,"Product Quality, Sales"
2882,satisfied time earned become calls ,Customer Service
2883,worst experience ordered st time cheap quality earphone not working opened not buy rd class waste money,"Product Quality, Sales"
2884,shoes fine,General
2885,hard get pencil ,General
2886,please not buy vendor,Sales
2887,really good product not expecting kind great quality watch really good features extremely good packing exceptional good thanks dark thanks seller keep product quality could better not matter low price not built quality always matter light passing screen bands hard price bracket ,"Product Quality, Sales"
2888,like product feel bad see product used already got finger prints tiny scratches although ok product needed like service dark team keep updated parcel suggest ply look cheerfully item sending make sure not dusty used took pictures cleaning still can see marks ,"Customer Service, Product Quality, Shipping, Technical Support"
2889,poor quality voice,Product Quality
2890,product picture catalogue darker received dull color anyway product fine good quality ,"Product Quality, Shipping"
2891,disappointed quality cycle lot scratches quality plastic poor seems like uses break,Product Quality
2892,size small can fit bike d dream,General
2893,buttons pressed quality really low,Product Quality
2894,received timely package good compare results act cheek difference hour checked axis not got difference tested reading got bit confused,Shipping
2895,box good not thing wanted,General
2896,not original product sound quality not good original recommend not buy seller buying pub otherwise ave sound quality within price bracket gone user can observe difference however seller seems nice sent thank note package ,"Product Quality, Shipping, Sales"
2897,read return policy carefully essentially not returnable ,Customer Service
2898,received time quality average no box pack derma roller order another page nice packing box roller proper box lid roller dispose plastic pack no box storage ,"Product Quality, Shipping, Sales"
2899,poor quality not per pictures,Product Quality
2900,product used,Product Quality
2901,audit quality bad not buy ,"Product Quality, Sales"
2902,ordered king size mattress sent queen size waste money,Sales
2903,pen cost apple not research market sad ,"Marketing, Sales"
2904,specific type product can used want relief foot his not used not find useful may find useful way try not expensive,Product Quality
2905,charging not good,General
2906,quality average ,Product Quality
2907,first order really disappointed left side peace work right piece not work ,Sales
2908,product ,Product Quality
2909,material lovely size small side ,Product Quality
2910,normal shampoo,General
2911,tried writing words joke words pad interpreted written maybe keep enters moment value no expensive wish knew worked many reviews ,Sales
2912,bad experience poor quality ,Product Quality
2913,fool stuff h,General
