,Review,Departments
0,trouser stuff good shirt poor quality,Product Quality
1,not leather jacket magazine quality not per description ,Product Quality
2,fragrance short shelf life months started develop unpleasant rapid smell disappointing invest fragrance go bad quickly expected better quality longevity ,"Product Quality, Shipping"
3,satisfied product good quality product,Product Quality
4,look ordered received ,"Shipping, Sales"
5,good delivery time pages book not good quality fulfill purpose ,"Product Quality, Shipping"
6,ordered two size instead got one smaller size material used good belt fit well hence giving star rating ,"Product Quality, Sales"
7,poor installation,Technical Support
8,purchased football two days aback item seems detective press ball passes air solve although no return solve forwarded query instant chat even call tender phone number mentioned receipt nobody responded finally going return product ,"Customer Service, Product Quality, Sales"
9,first box not come plastic pencil tip yellowish bent side connect pad not work can believe bought face apple product ,Product Quality
10,received damaged would not connect charge complete rip apple would not replace aerial number would not come actual apple system ,"Product Quality, Shipping"
11,think used,General
12,got fridge amazed even hours installing fridge not working not even cold inside dark delivered damaged product would advise everyone not get electronics webster cut never know product works not not know haste getting replaced customer service dark not helpful never attend calls responds days good luck ,"Customer Service, Product Quality, Technical Support"
13,good not glowing dark shown ,General
14,way ordered received still satisfied sound quality not quite good still according price range decent,"Product Quality, Shipping, Sales"
15,low quality ,Product Quality
16,good product not cotton soft,Product Quality
17,took amount never delivered product seller face dishonest please avoid seller completely requested refund already,Product Quality
18,ordered one problems sticking rest good keep good work thank ,"Technical Support, Sales"
19,not proper size mentioned,General
20,low battery time one earned not working properly voice also poor quality ,Product Quality
21,bakwasss left piece not work voice quality poor waiting money would suggest friends please not try,Product Quality
22,bad quality excepted ,Product Quality
23,beautiful not comfortable cut wear long,General
24,bad quality much expensive type quality st experience v v bad ,Product Quality
25,good not much good one bag zip,General
26,bad experience order large size receive large extra large medium size need replaced ,Sales
27,box received not sealed like everything seal apple pen also comes curtis not wrap not sealed open box literally papers feel second took not like amazon disappointed ,Shipping
28,per amount product ,Product Quality
29,nice product nice sound qualify timing little less,Product Quality
30,value money works fine good quality adjustable ,"Product Quality, Sales"
31,horrible experience making fool not ever buy broken no return policy disappointed dark ply stop making fools people,"Product Quality, Sales"
32,unfortunately newer model pencil compatible curtis not pads not mine funny can buy airport pair literally anything though go haste returning item donna buy pen thing actual reasonable price ,"Product Quality, Sales"
33,quality stuff really poor not know could bear st wash ,Product Quality
34,good quality shoes little disappointment rider delivery late little bit overall product awesome recommended seller,"Product Quality, Shipping"
35,size not accurate not happy purchase,Sales
36,product totally disgusting not even stop little whole water leakage ,Product Quality
37,cap shampoo ordered different one shown picture received black opening cap instead pink though packing good,"Shipping, Sales"
38,liked colours attractive smell neutral one order pump stuck cap not opening ,Sales
39,not good plastic bad smell not good quality not like ,Product Quality
40,face seller rude behaviour disappointed ,Customer Service
41,little bit expensive overall good,General
42,bad quality palate broken,Product Quality
43,poor quality stuff waste money ,Product Quality
44,packing good works fine well shampoo not fragrance ,General
45,disgusting second experience buying cycle dark bad experience time delivered wrong color cycle accessories incomplete wheel cups cycle missing without cycle useless waste rubles bad ,Sales
46,item not shown double sided,Product Quality
47,nothing good ,General
48,good late delivery,Shipping
49,shoes great size slightly big,General
50,received item not work several people look took necessary steps work not work ,"Product Quality, Shipping"
51,soft material recommended one size big,Product Quality
52,timely delivered quality product poor one day use became like land oaks fabric worn,Product Quality
53,nice accessory pad pro honestly can without personally not going use much thought would not see use not artist something honest pen galaxy note amazing apple pencil honest opinion get use tireless magnetic keyboard came pad pro case pencil sending mine back getting refund,Shipping
54,pathetic overpriced product not go ram actual mb ram hacked andros software extremely baggy absolute waste money,"Product Quality, Technical Support, Sales"
55,bad thing no lights showing low light,General
56,received parcel day in upset stars small size glow mineutraltes disappointed ,Shipping
57,better buy is handsfree quality extra price,"Product Quality, Sales"
58,order delayed one week anyone going order delivery definitely late wrote many times balance make continues follow late delivery issue ,"Shipping, Technical Support, Sales"
59,works coolly glio,General
60, stopped working second day still good,General
61,please not buy product seller note non return able can not return remote buttons not working works please not buy seller not good bad product cable small white box light connection poor little force applied comes yellow color button not work well red blue poor product sad called dark many times not buy,"Customer Service, Product Quality, Sales"
62,bad quality ,Product Quality
63,plastic quality high otherwise good ,Product Quality
64,thanks dark quality thorax sa fro ta par tiny past the ti,Product Quality
65,not support coolly models words ,Customer Service
66,pen not work contracted apple assistance informed pen old defective would not connect pad pro nd generation even hours help apple sent pen back ,"Customer Service, Product Quality"
67,received bit late usual dark delivery good packing good product,"Product Quality, Shipping"
68,like can write pad like pen not like can use write pad ,General
69,poor quality product waste money not serve purpose packing company claims many layers reality layer one plastic sheet inside no padded stuff even simple cotton extra cloth poor pathetic not buy ,"Product Quality, Sales"
70,spending expecting best arrived today requires attach pad pro charge came expensive fugue case attached pencil charging pen slide slightest movement magnet weak worse not work even relatively new pad pro not work phone pads returning ordering original pencil can charge via cable can protect pad axis not great cases many gimmicks apple products far many updated make things worse utf ,"Product Quality, Shipping, Technical Support, Sales"
71,not working ply can give another,Product Quality
72,extremely useless product not anything waste money sad receive ,Product Quality
73,order delivered days dot see difference applying ,Sales
74, star brick cap hardened spill package,Shipping
75,packing open customer never satisfied condition would believe unused not satisfied ,General
76,love product since dec th recently started looking charge not know pencil not good one ,Product Quality
77,received damaged scraped roller safe delivery,"Product Quality, Shipping"
78,quality bad can not hold anything g strips get gripped ,Product Quality
79,am writing review axis not like suit buy disappointed one wash dress still much inch still one wash not buy waisted ,Sales
80,products quality good products not use full,Product Quality
81,recently purchased pad pro gen genetic status pen fell love pen quit inside weeks since loved pen feature decided go ahead spend get thought would much superior product disappointed apple pen shaped poorly not round pen not roll easily hands pen also heavy compared writing utensils genetic pen purchased apple pen not give ability close pages using wipe feature instead free finger thumb perform function instead apple pen performance wee bit better genetic status simple purposes difference negligible double tap sideboard charging features not worth swap comfort genetic status gave expected much apple could return apple pen purchase genetic status axis not would ,"Product Quality, Sales"
82,stuff concerned okay not ,General
83,due bad weather received box wet condition luckily fabric cover safe intact found wardrobe described issue faced fixing plastic not properly cropped inside thankful assembled completely ,"Shipping, Technical Support"
84,belt ok not good pictures finishing cheap,General
85,wastage money,Product Quality
86,first really good colours point issue tape behind not stick table keeps falling hour half roll dead blue light meaning blue ones not work,Technical Support
87,not cleaning teeth said seller clean teeth product not no difference,"Customer Service, Product Quality"
88,size small toy,General
89,thanks dark team received order sound light system not working also plastic quality not good,"Product Quality, Shipping, Sales"
90,sound little bit sharp,General
91,got received broken one going return ,"Product Quality, Shipping"
92,average quality product ,Product Quality
93,product fine color different,Product Quality
94,freshness mark bit late night delivery ,Shipping
95,different picture bad quality recommend no one can buy waste money,"Product Quality, Sales"
96,one perfect light blue colour not working ,Product Quality
97,box open pen looks used paid full price not sure would send something used not okay going return get apple store ,"Customer Service, Shipping, Sales"
98,good yes nice button not glow,General
99,ordered sage oil send rosary oil professional ethical or second huge mistake totally un professional,"Shipping, Technical Support, Sales"
100,shoes not perfect got size small finishing also not perfect damage one side returning shoes not satisfied product ,Product Quality
101,light nice total lights lights plugs issue ply replace plug,Technical Support
102,not good cooked great difficulty ,Product Quality
103,looking old one damage packing no cell nosepin inside no protective packing material used ,Product Quality
104, rd class inverted never buy axis not winter noise compression loud bought units brand using strongly disappointed,"Marketing, Sales"
105,blue less specifically not work,Customer Service
106,quality ave compared price ordered another sweatshirt lower price dark select clot clot better terms quality ,"Product Quality, Sales"
107,pins pressed received package total waste money ,Shipping
108,useless product no result ,Product Quality
109,not satisfied product,Product Quality
110,warranty card given last year warranty expired dec however purchased may refrigerator not cooling anything ,Sales
111,colour good small size look like toy compare price including delivery charges expensive not good ,"Shipping, Sales"
112,expired products sent disappointed,Product Quality
113,waste money not even work charged three times yet still not work ,General
114,product good colourful lights bright colours accidentally broke ,Product Quality
115,disappointed last time ordered black good quality ,"Product Quality, Sales"
116,okay not highly recommended,General
117,little bit damage body sound quality quite fine price range delivered received time thanks seller,"Product Quality, Shipping, Sales"
118,worst seller defeated product waste money,Product Quality
119,order black brown receive black not good seller serve,Sales
120,sent wrong size ordered sent size tiny feet total wast money hurting ,Sales
121,annoying bad quality,Product Quality
122,shame dark making peoples fool package includes nothing sanitizer quality rd class ,"Product Quality, Shipping"
123,asked send brown red mentioned screenshot reminded almost times still sent wrong ones ,Shipping
124,size not fit quality good packing nice ,Product Quality
125,product good work not wide shown pictures still job recommend ,Product Quality
126,bad experience,General
127,worst apple pencil year not work anymore pure garage not buy anymore,Sales
128,lights started felling two days low quality,Product Quality
129,not bad not heel cover feel uncomfortable cause balance,General
130,best far reasonable ,General
131,stars defective,Product Quality
132,good sound charging time not working calling time use movie music time ,"Customer Service, Product Quality"
133, size small,General
134,love straightened packing box cheap also box fold,General
135,boiling water turn yellow color not recommended buy bad experience first time dark ,Sales
136,overall quality good got wrong size beck misunderstanding otherwise percent recommended,Product Quality
137,utility product good quality isn ,Product Quality
138,rd time ordered not satisfied unpleasant smell no expire date mean product old expired ,"Product Quality, Sales"
139,order blue size ok order size red twice account sent wrong size measurement can seen pick quality good,"Product Quality, Sales"
140,quality not good price ok thanks dark ,"Product Quality, Sales"
141,seems dry normally oats gets soft mind cooking took long time still felt undercooked taste not pleasant ,General
142,bought apple pencil pad pro inch surprised chagrined cannot used twitching apes making resort thumb instead pencil drawing plan status also purchased amazon superior every way ,Sales
143,potatoes good market buyer sweet dark fresh not sweet also item per web good see ,"Product Quality, Marketing, Sales"
144,attractive look sex slight tight recommended dark seller,General
145,shirt incredible great problems like sticks printed getting shirt colour also shedding days,Technical Support
146,not work suzuki every wagon useless no user guide use also phone not pair device can see recognize pad th gen sees not vehicle ,Technical Support
147,mere celebration not working properly ,Product Quality
148,packing not good product good show pictures,Product Quality
149,nice small size,General
150,shown picture unfortunately one damaged ,Product Quality
151,not high quality product gets job note ,Product Quality
152,good winter,General
153,truly disappointed seller could added barley hanna flour make least wheat no everyone quick bucks ,Shipping
154,compression ac tripping axis not axis not making cooling impossible ,General
155,product good quality blinds evenly skin good consistency packing also good small almost like finger can buy sample,"Product Quality, Sales"
156,overall better price week fabric started too come can see picture ,Sales
157,seems like used article bad experience ,General
158,lights not proper light little tiny strip work strip length iss totally useless behavior guns fixing spotted problem really disappointed ,"Customer Service, Technical Support"
159,given local product away packing also packing also broken not satisfied product need refund,Product Quality
160,not charging went also give voucher also,General
161,not worth ,General
162,cheek plastic useful,General
163,sounds quality good mid not bed mark ,Product Quality
164,connected old gen pad baggy device shape seems hard grip ,Technical Support
165,poor service two hand frees ordered one delivered spasm guns,"Customer Service, Sales"
166,product good it size not comfortable change axis not book extra large size need size,Product Quality
167,seller so cooperative quality normal,Product Quality
168,stars size much small ,General
169,average almost turned sides days use,General
170,pen perfect always if see buy stuff online far good,Sales
171,waste money not comfortable got fold whenever sit,General
172,sizes incorrect,General
173,worst experience far got faulty nods these not connect infinite note pro connect seconds gets automatically disconnected ,"Customer Service, Product Quality, Technical Support"
174,potato order kite rider kiss to deliver india bad complex not par roi response nail did gay,"Customer Service, Sales"
175,classic case cool technology failing miserable tried true analogy pencil pen sleek cool efficient not come charge take pad case pair charge pencil not easy get case handwriting conversion text annoying helpful get good keyboard instead want take notes type onto pad ,Customer Service
176,ordered white airport got black one ,Sales
177,not buy vendor absolutely fraud powder colour not like muslin powder full sand particles dust,Sales
178,not mark expensive product low quality fabric,Product Quality
179,got january one sides stopped working may total four months life span ,General
180,dear dark order blue color said seller need size unfortunately send black color size already chat order fraud shoes finishing pathetic hard sole worst experience need pay back ,"Customer Service, Shipping, Sales"
181,fragrance strange chemical undertone putting made overall scent unpleasant unnatural could not shake feeling wearing something synthesis rather well drafted fragrance ,General
182,good becomes sticky wearing first time not fully satisfied,General
183,item looked fine not seem damaged apple pencil purchased amazon com services ll already unwrapped arrived sold new not want take granted would continue okay would hold warranty apple called confirmed not packed way not know actually used used long already used maybe someone not want returned trying not know came way apple store may unwrapped distribution center returned item instead bought directly apple store item came packed new ,"Customer Service, Product Quality, Shipping, Sales"
184,bad quality never buy ,"Product Quality, Sales"
185,product ok working condition housing structure wise much lower good product thanks ,Product Quality
186,price frames market hundred,"Marketing, Sales"
187,sent completely different product,Product Quality
188,hoofs kind open shape looks kind odd still pretty cool ,General
189,good quality arrived bit late otherwise okay overall satisfied,"Product Quality, Shipping"
190,punch order product get packing within box buds overall product good fully satisfied thanks dark good work delivery time ,"Product Quality, Shipping, Sales"
191,ordered frames received price quality product average,"Product Quality, Shipping, Sales"
192,compass not working properly rest item seems fine use soon,Product Quality
193,ordered number send shoes quality low puff bad experience,"Product Quality, Shipping, Sales"
194,cheap quality ,Product Quality
195,not good better purchase refine cloth cover ,Sales
196,product quality not good working ok thanks dark ,Product Quality
197,leg temps per no function ,General
198,bad experience battery life poor one earned isn working data cable not charging device low poor quality ,"Product Quality, Technical Support"
199,color ordered clearly black received blue mildly satisfied got delivered delivery estimation quality accordingly price paid item,"Customer Service, Product Quality, Shipping, Sales"
200,item good little small size however note job nicely ,Product Quality
201,got slammed,General
202,asked back one sent brown one instead,General
203,pencil not work brought apple store tried get son pad keyboard would not son apple store replaced still awaiting two year warranty paid not receive ,Customer Service
204,first packing poor professional pad feels used ,General
205,not hold long charge gen one pencil way charge attaching pad would prefer secondary option charge pencil using pad not want attached pad lose need charge costs already price pen actually cumbersome use can charge magnetically connected pad can no longer easily use pen grip comfort cause get way charging pen also tried two ribs like screw time fall not offer second rib like gen ,"Customer Service, Sales"
206,low quality bags,Product Quality
207,nice finishing sticking size bit smaller standard ok ,Product Quality
208,average quality not big size ,Product Quality
209,scar showed branded product picture delivered branded product even expire date not mentioned good normal use can not use babies disappointed,"Product Quality, Marketing"
210,please not buy seller ,Sales
211,ordered bags received total unbelievable would not order axis not,"Shipping, Sales"
212,safe packing not check fragrance yet,General
213,delivered promised next day ordered mouse pads one better wrist pad quality two mouse pads low quality wrist pads ,"Product Quality, Sales"
214,print not good not shown picture,General
215,disappointing reviews face ordered steel instead got wooden one low quantity ones never ordering axis not ply reviews face not order made material toothpicks made not order,"Product Quality, Sales"
216,not bad size small like kid toy,General
217,bad experiences voice not clear package not sealed,Shipping
218,not waterproof waste product never oder anything dark,Product Quality
219,honest review not worth buying quality not good ,"Product Quality, Sales"
220,good quality product stitching not good overall good ,Product Quality
221,arrived time would not say best material used price definitely good quality serves purpose well arrived given time good experience,"Product Quality, Shipping, Sales"
222,got christmas used solid couple days suddenly started missing parts letters write really frustration wanted apple pencil bad palm rejection like not work time really irritating ,General
223,worth money ultimate question writing drawing experience great usual lots bells whistles apple enthusiast would probably drop major coin accessory without question average consumer importance not paramount could lived without added benefits provides still apple pencil great product complements pad air milk every dollar put enjoy best can ,Product Quality
224,pen works great rd one charge lasts okay accuracy fine great procreate hate price absurdly overpriced companies better useful pens cheaper ,Sales
225,device per specification battery device dead discharge one day lucky battery naval everywhere,Technical Support
226,not fresh,General
227,sorry late review order lightning stuff send simple white color upset delivered kiss,"Shipping, Sales"
228,not soft original one great quality price ,"Product Quality, Sales"
229,extremely poor low quality materials used manufacture wallet seller specified paper cards used wallet instead sort fabric good kiss not adult people want carry money use regularly ,Product Quality
230,ordered pencil use new pad school coming used screen came squiggly line would not write properly since solved particular issue says still transit asked refund failing pencil back amazon want money back poor customer support would not purchasing anything related apple point ,"Customer Service, Technical Support, Sales"
231,glitter bottles half full small size his not bottles colors good however ,General
232,little crack side,General
233,absolute trash look length showing feature image look delivered,General
234,watches good quality ordered pink black black ,"Product Quality, Sales"
235,tried make connection car scanned motor data true pro old car doctor not get success pp ,General
236,quality wise size big taste bland,Product Quality
237,not interesting product,Product Quality
238,handsfree good delivery time bit late everything okay and good,Shipping
239,best product price range heavy duty however finishing not good still works ,"Product Quality, Sales"
240,expensive item available is local market ,"Product Quality, Marketing"
241,bad quality oil smell found bars ended returning ,Product Quality
242,not advertised dont hold shirt ,Marketing
243,nice quality best make video party etc time wear black big size delivery soon late,"Product Quality, Shipping"
244,nice item poor price ordered number received ,"Product Quality, Shipping, Sales"
245,near expire huge lumps forming not fresh product,Product Quality
246,received ordered item new condition ,"Product Quality, Shipping, Sales"
247,not proper working device want change device,Technical Support
248,ordered blue colour got different plastic also low quality packing even getting discount still expensive price overall disappointed ,"Product Quality, Sales"
249,box not lights remote adapted scar ,General
250,product worthless one laser light not working nd one screws lose opens open cell came furthermore already send order no into desired colours not get colours ,"Product Quality, Shipping, Sales"
251,order delivered late email says going delivered days got weeks,"Customer Service, Sales"
252,breaks applying wall delicate not unable ,General
253,also nice nd originally order ll size nd send large not fit overall the,"Shipping, Sales"
254,ordered large size send extra large also quality just ok not high quality,"Product Quality, Shipping, Sales"
255,totally damaged used time wrong hardly joined parts first experience bad never recommend ,Product Quality
256,looks really had wrapped gloss black ,Shipping
257,good quality colors dark ,Product Quality
258,not work older pads,General
259,poor third class quality,Product Quality
260,small size compare size xiaomi fitness band get buyers idea size ,Sales
261,media could not loaded ,General
262,nice awesome product not see picture,Product Quality
263,shirts quality rest poor material defects like tight neck,Product Quality
264,poor quality used material,Product Quality
265,returned phantom drop to tis two days did th armada th day past did still status pending ,General
266,good good quality headphones delivery late thank ,"Product Quality, Shipping"
