,Review,Departments
4232,quite ordinary received one despite ,Shipping
4233,purchased first pencil last week looking forward using new pad pro upon opening found would not charge pair pad spent next couple days trying different things troubleshoot nothing worked let pencil sit overnight charging another pad simply would not work contracted amazon explain noted situation sent another pencil opened hours ago far problem going call schedule appointment get fixed awesome paperweight ,"Customer Service, Technical Support, Sales"
4234,received described not suitable hard things ear cleaning ,Shipping
4235,can not find harm using ,General
4236,spoiling dark name please discontent types vendor ,General
4237,ordered two delivered time sound good touch senior also working give four stars mid not working commonly ,"Product Quality, Sales"
4238,purchased terrified refurbished received status type broken treading imbedded pencil no way get ,"Product Quality, Shipping, Sales"
4239,yes poor quality found nail sole injured foot requested kindly check item sending customer thanks dark,"Product Quality, Shipping"
4240,could big improvement a double tap functionality better balance however a designed continuous charging attached pad oris not quite bit tablet battery not using device believe drop overnight deal breakers ,"Technical Support, Sales"
4241,buy daughter christmas gift not really use often middle march pen not work contact amazon said contact seller send seller message one week nobody answers ,"Customer Service, Shipping, Sales"
4242,v bad low quality items ,Product Quality
4243,less price quality good normal,"Product Quality, Sales"
4244,worked months would not connect pad restarted pad forgot apple device bluetooth settings pips connect would not actually connect pad ,Technical Support
4245,received literally different colour tollers total waste money would not even buy free disgusting seller ,"Shipping, Sales"
4246,packing perfect delivery time stuff superb found holes surface area near paper tag,Shipping
4247,worst quality headphones ,Product Quality
4248,not shown picture disappointed,General
4249,poor quality,Product Quality
4250,not working bad experience returning thanks,Product Quality
4251,returned old piece sent back lose,General
4252,order received time packing not proper although items received one piece not yet checked performance ,"Product Quality, Shipping, Sales"
4253,really expensive also dropped mistake not properly stick magnetic pad riding tip bent slightly worked one half pen purchased replacement tips price accuracy sometimes slightly would expect better quality pen,"Product Quality, Technical Support, Sales"
4254,quality basket good finishing partitions not good partitions rough sharp edges ,Product Quality
4255,came quickly everything issue charging alllll day still not connecting even registering watched every video read every tutoring yet nothing working registering connecting in bit frustrated took awhile even decide take plunge spend much status highly anticipated arrival ,"Shipping, Technical Support, Sales"
4256,poor quality material used not working massage rods thin fear damaged body parts,Product Quality
4257,cut barges not how keep falling though convenient keep worrying dropping middle market ,Marketing
4258,tricycke good like picture it asked purple colour nd sent blue colour ,General
4259,ordered received quality not good reason not able his notes not air pressure ,"Product Quality, Shipping, Sales"
4260,found adhesive bandages received dark extremely weak would barely stick skin result would constantly fall frustration inconvenient keep applying new bandages,Shipping
4261,quick delivery used pot not clean shown video product seems face like him max powder disappointed ,"Product Quality, Shipping"
4262,ordered ll size although large fits ll usually quite loose sizes company much small guess order xxxi future otherwise good,Sales
4263,useful bags not high quality cost effective thanks ,"Product Quality, Sales"
4264,missed charge ,General
4265,checked questions lied monitor stand not fitting due screen cracked little bit,General
4266,totally change third class,General
4267,delivery early horns not unto standard,"Product Quality, Shipping"
4268,sound quality less expected ,Product Quality
4269,that sent small size in not good,General
4270,bought along new pad turned incompatible missed return window stuck useless stick stupid apple made incompatible new devices ,Technical Support
4271,pencil use pencil new pad extremely disappointed opened apple box find face apple pencil not compatible pad contracting seller refund update review later heard back seller ,Technical Support
4272,product small like toy ,Product Quality
4273,pencil not work even bought new tips hoping would work still not would not buying anymore used apple products anymore learned lesson,"Product Quality, Sales"
4274,bad quality much suffering mid speaker port heart breaking ,Product Quality
4275,required neck band earphone delivered wrong item ,Product Quality
4276,receive parcel today quality base good love joining axis not need something else thnkxx trusted review giving star rate using airport thanks thing excellent quality delivery also good packing good,"Product Quality, Shipping, Sales"
4277,product cheek ha price lihaaz se both costly ha dark wales vilna delivery ka le they they ah shop se mild data mere dismay arab money bad pa chalk,"Product Quality, Shipping, Sales"
4278,low quality shape not good,Product Quality
4279,not bright shown pictures quite dim suggest buy ali express around price worth least,Sales
4280,yeah product amazing prices high,"Product Quality, Sales"
4281,got delivered time seller seems nice guy used one day can tell whether works not definitely felt needed pressure jaw assume work seen video couture product similar one hopefully work long run ,Product Quality
4282,waste money time poor quality packing worst experience,Product Quality
4283,quality product extremely questionable much noise and one two ear pieces not work ,Product Quality
4284,power bank faulty not charging ear phone pads ok no charging lights grows not charging ,"Product Quality, Technical Support"
4285,cheap quality ,Product Quality
4286,good not high quality,Product Quality
4287,asked him cable see photo sent can corrected ,General
4288,not work bad experience dark,General
4289,not tag label literally small like sell clothes kiss,General
4290,point back lit keyboard can even see keys keys opaque his noted white top keyboard quality not bad completely loses purpose ordered ,"Product Quality, Sales"
4291,general quality appears satisfactory product appears used evidenced dirt sickness log pricking reasonable would suggest provide new product ,Product Quality
4292,showed dark blue colour ad sent black color edges cut roughly make no sense thin make useless non sense product,Product Quality
4293,definitely good purchase problem selection colours luckily hot better one seller ask order shade sheet ,"Technical Support, Sales"
4294,wanted buy not found,Sales
4295,bad bluetooth hand free not even with charged hours right peace died mind sound left piece distort much bad quality airport disappointed not recommended please not waste money ,Product Quality
4296,quality okay one grades kind blue ,Product Quality
4297,like apple pencil tried several different third party ones definitely works best is devices apple pencil feels like writing big plastic pencil window also obnoxious loud whenever press screen quiet room people going hear writing thing find mildly annoying meetings love new pad still think pens older samson tablets natural feel overall better drawing good light stretching notes would recommend getting separate non pad drawing tablet professional artists ridiculously overpriced considering manufacturers include pressure sensitive styluses work better no additional cost tablets axis not still best pad not great ,"Product Quality, Technical Support, Sales"
4298,one working fine second one broken voice not good overall quality opinion poor ,Product Quality
4299,stop working days poor experience,General
4300,last time sent perfect lights time sent color rib lights disappointed totally ,General
4301,product looking nice battery timing low,Product Quality
4302,perfect expensive according quality nd cheap stuff,Product Quality
4303,good product quantity little bit less,Product Quality
4304,perfect small size thanks ,General
4305,rate issue huge price gap seller price received item pathetic service ,"Customer Service, Product Quality, Shipping, Technical Support, Sales"
4306,received order today slow mode not working rather good ,"Product Quality, Shipping, Sales"
4307,not satisfied zip broke fabric quality also not good,Product Quality
4308,average quality,Product Quality
4309,first order awesome ordered bulb axis not ended failed peace bulb not working am much disappointed or product ,"Product Quality, Sales"
4310,not think brand new apple pen would not connect tablet despite saying charged first apple pen came tip replacement one not ,Marketing
4311,pen works amazing quality received not great using month rib already worn metal rib bent can not straighten ,"Product Quality, Shipping"
4312,poor cleansing brush not like ply not buy anyone hard use one time make face like fully red cause acne size small,Sales
4313,charged is per piece printed price soap is ,Sales
4314,stopped working month,General
4315,not product ,Product Quality
4316,product quality good mount swinging frequently ,Product Quality
4317,good packing bad ,General
4318,block print cheap small length breadth not fit fridge microwave bad disappointing,General
4319,three past months spent fuel bringing back forth apple repair replacement quit working finally bought market pen for fraction cost not issue not let mail repair really dropped ball one better apple,"Technical Support, Marketing, Sales"
4320,always charged barely used pencil worked fine first not online apple support could not provide solution travel service center get addressed ,Customer Service
4321,good product dual system not working malbrook,Product Quality
4322,sir bought two lights got light giving dim yellow light would like buy another light please resolve issue light well ,"Technical Support, Sales"
4323,extremely poor quality watery not stay cup,Product Quality
4324,average quality ,Product Quality
4325,prices higher market price,"Marketing, Sales"
4326,rip apple controlling market forcing us purchase something,"Marketing, Sales"
4327,sorry not work tried apes pp store could not connect car suzuki diana useless ,General
4328,pencil weeks purchased along side new pad pro used mostly note taking project planning work pencil perform phenomenally especially procreate nobility responsive easy draw pressure sensitivity excellent unfortunately tip quickly wore less weeks expecting least months even heavy usage tip not covered warranty expect tip get damaged apple not offer replacement ,"Product Quality, Shipping, Sales"
4329,waste money bad ,General
4330,quality ok price want good quality not recommend product ,"Product Quality, Sales"
4331,nice shoes love much size little bit small ok,General
4332,normal experience like ave lanfrey,General
4333,not bad not good stuff poor ,General
4334,fraud not single percent shine totally dissatisfied ,General
4335,transparent plastic dusty need tu wipe clean ok ,General
4336,not good colours fabric bad totally different,General
4337,small size no shining disheartening ,General
4338,not shown advertisement okay price ,"Marketing, Sales"
4339,good finishing me thorax sa ,General
4340,ordered two g got single g quality good not ordered ,"Product Quality, Sales"
4341,item promised brand new slightly damaged box however item not even work item would not pair pad compatible top cosmetic defects promised otherwise luckily able return would send faulty item begin wary purchasing electronic items amazon,"Product Quality, Shipping, Technical Support, Marketing"
4342,bad cowaity no respect,General
4343,not big not perfect mouse problem right key not working,"Product Quality, Technical Support"
4344,not buy guns recycle plastic simply poor poor quality no color scheme ,"Product Quality, Sales"
4345,came good stopped sticking like day ,General
4346,good perfumed different scent nice although not stay long packing box though ,General
4347,decided buy like new option new piece stock whilst product worked okay item supposed minor damage packing whereas pencil showed clear signs use wear tear tip returned product ,"Product Quality, Sales"
4348,ordered new apple pencil live guam shipping dollars plus already expensive price point got house weeks later already opened used tip black buy new product expect get new product ,"Product Quality, Shipping, Sales"
4349,items mark except dhaniya point,Product Quality
4350,remote isn working overall lights good his not issue remote isn working can control lights without remote ,Technical Support
4351,bad experience dial broken watch not working,Product Quality
4352,really disappointing strongly not recommended,General
4353,always buy product time not satisfied,"Product Quality, Sales"
4354,assume alike sir issue one port not connected phone ,Technical Support
4355,face shoes not right size not right order return back,Sales
4356,first days working perfectly fine stopped working,General
4357,expensive poor quality,Product Quality
4358,not satisfy product can see many scratches cooper,Product Quality
4359,apple pencil nd generation delivered house days ago not connect pad pro inch called apple support could not get connect purchased amazon not apple unable return replacement refund highly dissatisfied ,"Customer Service, Sales"
4360,totally changed product disappointed no wrist grip not worth according price ,"Product Quality, Sales"
4361,got one pair shoe ordered pairs ,Sales
4362,good product budget price ,"Product Quality, Sales"
4363,waste money like tested,General
4364,hand free disgusting smaller send broken device side useless smaller send order one half week ,"Product Quality, Shipping, Technical Support, Sales"
4365,size not perfect ordered one ll xx send large according size chart large disappointed,"Shipping, Sales"
4366,not like not work even tried them,General
4367,low quality ,Product Quality
4368,came cheapest product ever not work plantation price extremely unreasonable cable peter length not recommend ,"Product Quality, Sales"
4369,es realmente buena lo que no gusto es que s punt se desgasta demasiado per s technology es realmente may buena pages calidad solo la punt fall ,General
4370,size not accurate written ll actually large medium fabric quality also not good ,"Product Quality, Sales"
4371,came know g can bought rubles expensive,General
4372,seriously guns sent lavender baby oil ,General
4373,agree dark not agree not good ,General
4374,bad quality ,Product Quality
4375,voice quality okay not good like radio kind quality voice bluetooth conductivity working superb ,Product Quality
4376,hello return package dark not return amount page,Shipping
4377,ordered scott got wrong tarsal ,Sales
4378,not worth show,General
4379,battery issue ,Technical Support
4380,good kind wish colours,General
4381,oil satisfactory,General
4382,bad product no result waste time money recommend not buy,"Product Quality, Sales"
4383,stopped charging months dead completely useless ,General
4384,face product ,Product Quality
4385,stars not shining ,General
4386,know apple makes great products lot time got lemon delivered zero percent charge would not charge no matter tried obviously returning intend order replacement would not deterred got rare did ,"Product Quality, Sales"
4387,poor,General
4388,good not miracle worker write ,General
4389,garage quality better buy dark select ,"Product Quality, Sales"
4390,purchased apple pencil christmas gift wife opened try set would not charge can imagine great disappointment make matter worse no support barbadoes second apple product arrived dead thinking never buy apple product axis not ,"Customer Service, Product Quality, Shipping, Sales"
4391,product endless frustration since first stopped working month minimal use even pencil connected pad via bluetooth full charge brand new rib tightly fastened freshly cleaned screen not work not register screen even tried removing paperlike screen protector got case would get register axis not no luck able get working following methods twice particularly tightening rib goes back broken day clearly something wrong hardware bought actual apple store unfortunately closed due anaemic can not even find replacement would never recommend something expensive faulty anyone ,"Product Quality, Shipping, Technical Support, Marketing"
4392,packing good lights good well one complex not one remote not working tried changing battery still not work could remote replaced please ,Product Quality
4393,audit quality not good expecting better price,"Product Quality, Sales"
4394,first time using creating results not expectations still his noting muscle size yeah least effective ,General
4395,good not heavy clothes light,General
4396,disappointed weak motor not even beat coffee not waste money ,General
4397,not good one broken jack bought considering original not sound quality not bad not much good real one moreover audit jack produce noise whenever touched gets disconnected filing refund product not good described ,Product Quality
4398,color little bit different picture showing product image last time order color shown picture fragrance totally different pungent compared one ordered months back ,"Product Quality, Sales"
4399,dear shoe size wrong order no received no not good ,"Shipping, Sales"
4400,used not good disappointed bad delivery,Shipping
4401,not good not buy ,Sales
4402,pad nd generation pencil came used item,Product Quality
4403, friends not buy must al mahan products,"Product Quality, Sales"
4404,fine not broken anything like ordinary diffuse ,Product Quality
4405,size bit small,General
4406,price sell ,Sales
4407,product quality normal not excellent expected right side airport not working properly box also opened not satisfied ,Product Quality
4408,satisfied purchase price quality good material not unable since price less overall good purchase ,"Product Quality, Sales"
4409,total fraud no free installation changing rubbed call center told said dark deceiving us no free installation paid ,"Customer Service, Technical Support"
4410,what replace due gas witch not safe ,General
4411,today received pump first charged three hours tried use bottle not working water really disappointed product time start working abstract water put axis not stop working return criterion really disappointed supplier draw,"Product Quality, Shipping"
4412,overall good experience seller found bend towards centre annoying pad can tell due lack attention detail yet non slip build not amazing satisfactory,Product Quality
4413,small quantity not really stick hold ,General
4414,got torn easily,General
4415,ordered two send ,"Shipping, Sales"
4416,size pots really small worst money,General
4417,best ever look price rd order ,Sales
4418,red led always remits not even turning remote also twitching blue green also keeps red faulty item ,"Product Quality, Technical Support"
4419,ordered brown colour delivered burgundy colour really bad never expect type blunder company,Sales
4420,not shown picture true disappointment,General
4421,better quality not good,Product Quality
4422,nice colors also patterns bit expensive ,General
4423,product costly compared quality volume not high enough little bit issue voice clarity ,"Product Quality, Technical Support, Sales"
4424,products good like show post delivery time not know result use know result,"Product Quality, Shipping"
4425,magnet aren strong enough find constantly dropping attached pad case built pen holder finding less less useful ,General
4426,poor experience hour saying tu tu low battery well not satisfied not buy axis not thankyou,Sales
4427,okay build quality could better,Product Quality
4428,quality good angles large size small size not fit ,Product Quality
4429,overall good must say come dropped product could not comfort tiny holes can squeeze press bottle made glass,Product Quality
4430,light colour product awesome ,Product Quality
4431,happy seller recommend buy store first size not fit returned ordered axis not perfect ,Sales
4432,disappointed dumbells order comes days smells comes rubber slim line company way much better not recommend,Sales
4433,not satisfied heavy delivery charges ,Shipping
4434,shoes ok per price packing broke old ,Sales
4435,delivered time packed well quality update month ,"Product Quality, Technical Support"
4436,good quality shipping charges much,"Product Quality, Shipping"
4437,received parcel quality not good color not picture,"Product Quality, Shipping"
4438,original product packing not safe,Product Quality
4439,bad experience seller ,General
4440,displayed pictures air pressure not satisfactory not even clearing dust properly ,General
4441,received product ordered quality shoes not fine price quality acceptable overall satisfied product recommended ,"Product Quality, Shipping, Sales"
4442,cap not displayed pick,General
4443,apparently new pencil compatible pad pro luckily st gen still available online ,General
4444,disappointed charging light not charge remove charge turns ,General
4445,average quality cap broke couple days ,Product Quality
4446,size issue much smaller used past,Technical Support
4447,face product face product face product please not purchase ordered pieces face report account fraud action report lead delete fraud account not purchase immediately return product dark warehouse save money ,"Product Quality, Sales"
4448,packing not good scandal ok normal quality,Product Quality
4449,in disappointed purchase can bought shouting lights dull not shown pictures currently dint picture attach in disappointed purchase store bad service ,"Customer Service, Sales"
4450,ghatiya three product not buy ,"Product Quality, Sales"
4451,media could not loaded bought used one like new not work ,General
4452,bad plastic quality,Product Quality
4453,nothing like picture disappointed,General
4454,lights worked great first two days however two days light strip broke adapted wire lights immediately stopped working disappointed ,General
4455,not leather ,General
4456,fragrance first not understand nor like the no okay,General
4457,nice product ordered products dark send product time is product product not buy bruhhhh ,"Product Quality, Shipping, Sales"
4458,shows much comfortable imagined price range him not bad not shabby taras wasaiyon keep good work ,Sales
4459,lies ,General
4460,really good broke side days,General
4461,not even close picture shown,General
4462,dwyer fine ,General
4463,sent faulty unit tried different cars not work ,"Product Quality, Technical Support"
4464,not like bought mon disappointed stopped working months lucky enough get replacement apple store that reputable store sore not sure amazon would note anything mon quit amazon ,General
4465,not original give static time low volume ,General
4466,really looking forward using pencil regularly year not working elongated paperweight truly disappointed ,Product Quality
4467,selected condition new searching ordering pencil received hard used cracked item instead works not thought paying returning ,"Product Quality, Shipping, Sales"
4468,normal product can give try,Product Quality
4469,not satisfied small size probably less was not red tasted less ordinary nothing disappointment ,General
4470,bag literally size palm small would not not like pictures dirt particles squished ,General
4471,size bit small overall justified price good experience ,Sales
4472,knew purchase little thinner others wanted colors looking find thick ones take long time dry absorbed fast easy wash dry ,"Shipping, Sales"
4473,used good,General
4474,give trash ,General
4475,pencil probably fine drawing casual notes real business note taking awful gimmick joke returned immediately really wanted work wanted like would improved filing organization ,General
4476,product quality bad,Product Quality
4477,ok boss ,General
4478,decent sound quality poor battery timing though ,Product Quality
4479,not order trying clear damage stock delivery made late well delivered damages article disappointed never donna order electronics dark pp,"Shipping, Sales"
4480,reviewing month black color fades time overall works fine,General
4481,good average quality,Product Quality
4482,small gazing,General
4483,bottle received damaged my lost ,"Product Quality, Shipping"
4484,bad experience ,General
4485,product good new pack working not support ,"Customer Service, Product Quality"
4486,ordinary,General
4487,not good waste money applied weeks no result complete waste,General
4488,disappointed hardly gives negative remarks time really much disappointed looking response seller,Customer Service
4489,all scratches ,General
4490,outer unit no gas vendor send technical check c not sanctioning although got unit installed terrible service vendor since check product condition shipping ,"Customer Service, Product Quality, Shipping, Technical Support"
4491,poorly packed damaged bristled,Product Quality
4492,product price good good beginners wheels no barring hard plastic instead ,"Product Quality, Sales"
4493,bad experience sound,General
4494,colour not good good speaker ,General
4495,sticking not good,General
4496,bottles small brush broken intentionally make fit packing brother happy satisfied,Product Quality
4497,color silver no wife available found dr instead using cup giving earth shows supplier checking much inferior quality much afraid using online bad experience,"Customer Service, Product Quality"
4498,size not received,Shipping
4499,want improve quality good price,"Product Quality, Sales"
